{
  "budget": {
    "max_iterations": 200,
    "max_tool_calls": 5000,
    "network_policy": {
      "allowed_classes": [
        "github_api_write_via_gh_cli",
        "docs_fetch_readonly"
      ],
      "allowed_domains": [
        "api.github.com",
        "github.com",
        "json-schema.org",
        "www.rfc-editor.org",
        "cursor.com"
      ],
      "mode": "allowlist"
    },
    "wall_time_seconds": 14400
  },
  "contract_id": "aec-issue-4258-live-cursor-pilot",
  "created_at": "2026-08-03T00:00:00Z",
  "environment": {
    "environment_profile": "mock",
    "mcp_profiles": [],
    "provider_profile": {
      "extensions": {
        "api_surface": "cloud-agents-v1-public-beta"
      },
      "profile_name": "cursor-cloud-api",
      "provider_id": "cursor-cloud-api"
    },
    "secret_references": [
      {
        "class": "provider_api_key",
        "ref": "env:CURSOR_API_KEY"
      },
      {
        "class": "github_token",
        "ref": "env:GH_TOKEN"
      }
    ],
    "skills": [
      "cdb-session-start",
      "cdb-pr-router",
      "cdb-session-close"
    ],
    "subagents": []
  },
  "execution_scope": {
    "allowed_commands_or_command_classes": [
      "git_read",
      "git_commit_push",
      "pytest_unit",
      "ruff_check",
      "gh_issue_comment",
      "gh_pr_edit",
      "python_module_tools"
    ],
    "allowed_paths": [
      "docs/contracts",
      "docs/contracts/*",
      "tools/agent_control",
      "tools/agent_control/*",
      "tools/agent_execution_contract",
      "tools/agent_execution_contract/*",
      "tests/unit/governance",
      "tests/unit/governance/*",
      "tests/fixtures/agent_control",
      "tests/fixtures/agent_control/*",
      "config/agent-control",
      "config/agent-control/*",
      "knowledge/governance",
      "knowledge/governance/*",
      "knowledge/logs/sessions",
      "knowledge/logs/sessions/*",
      "agents",
      "agents/*",
      "AGENTS.md",
      "tests/fixtures/agent_control/cursor",
      "tests/fixtures/agent_control/cursor/*"
    ],
    "delivery_target": {
      "expected_status": "DONE_SLICE_ADDED_TO_BATCH_PR",
      "mode": "batch_pr",
      "target_branch": "batch/agent-skills-issue-4258",
      "target_pr": 9999
    },
    "forbidden_paths": [
      "services",
      "services/*",
      "core",
      "core/*",
      "infrastructure/compose",
      "infrastructure/compose/*",
      ".github/workflows",
      ".github/workflows/*"
    ],
    "issue_scope": {
      "delivery_issue": 4258,
      "forbidden_follow_on_issues": [
        4259,
        4260
      ],
      "topic": "AGENTS Control Plane Pilot Foundation"
    },
    "stop_conditions": [
      "HOLD_NO_SAFE_ROUTE",
      "HOLD_DEPENDENCY_NOT_READY",
      "HOLD_SCOPE_DRIFT",
      "HOLD_CONTRACT_INTEGRITY_NOT_PROVEN"
    ]
  },
  "integrity": {
    "canonicalization": "RFC8785",
    "digest": "sha256:800159427aa91b9b331ae71353072b2f7c41e34e38f4bd08667cb7f497d9dd25",
    "digest_algorithm": "sha256",
    "digest_encoding": "sha256:<lowercase-hex>"
  },
  "issue": {
    "number": 4258,
    "parent_issue": 4249,
    "predecessor_issue": 4257,
    "title": "[AGENTS][PILOT] Prove one end-to-end Cursor delivery and approval flow"
  },
  "permissions": {
    "close_issue": false,
    "comment_issue": true,
    "commit": true,
    "database_mutation": false,
    "mcp_live_mutation": false,
    "merge": false,
    "open_pr": false,
    "publish_cdb_local_ci": false,
    "push": true,
    "read_repo": true,
    "runtime_mutation": false,
    "update_pr": true,
    "write_code": true,
    "write_docs": true
  },
  "producer": {
    "agent": "cursor-cloud",
    "component": "pr_router_handoff",
    "policy_id": "cdb-pr-routing-v1"
  },
  "provider_work_order": {
    "prompt_digest": "sha256:850bc9495f0de2f3d72ec9f3e308308e070bd4656e6999770ffb38b96e74fb56",
    "prompt_ref": "tests/fixtures/agent_control/cursor/prompt_ok.txt",
    "source_commit": "aaaaaaaaaaaaaaaaaaaaaaaaaaaaaaaaaaaaaaaa"
  },
  "route": {
    "batch_key": "agent-skills",
    "lane": "agent-skills",
    "lock_state": "UNLOCKED",
    "merge_mode": "batch",
    "policy_id": "cdb-pr-routing-v1",
    "reason_codes": [
      "CREATE_NEW_BATCH_WITH_DEFAULT_METADATA"
    ],
    "router_observed_at": "2026-08-02T23:02:36Z",
    "routing_decision": "OPERATIONAL_BATCH_CONTINUATION",
    "target_branch": "batch/agent-skills-issue-4258",
    "target_pr": 9999,
    "validation_profile": "agent-skills-v1"
  },
  "schema_id": "cdb.agent_execution.v1",
  "schema_version": "1.1.0",
  "validation_and_delivery": {
    "allowed_delivery_statuses": [
      "DONE_SLICE_ADDED_TO_BATCH_PR",
      "HOLD_DEPENDENCY_NOT_READY",
      "HOLD_PR_LOCK_CONFLICT",
      "HOLD_NO_SAFE_ROUTE",
      "HOLD_SCOPE_DRIFT",
      "HOLD_CONTRACT_INTEGRITY_NOT_PROVEN"
    ],
    "evidence_requirements": [
      "targeted_slice_validation",
      "brain_evidence_block",
      "router_decision_record",
      "contract_hash_record",
      "issue_comment_handoff"
    ],
    "merge_authority": {
      "granted": false,
      "role": "none"
    },
    "required_validations": [
      "pytest tests/unit/governance/test_agent_execution_contract_v1.py",
      "pytest tests/unit/governance/test_pr_routing_contract.py",
      "git diff --check",
      "python -m tools.validate_readme_links"
    ]
  }
}
