{
  "budget": {
    "max_iterations": 200,
    "max_tool_calls": 5000,
    "network_policy": {
      "allowed_classes": [
        "github_api_write_via_gh_cli",
        "docs_fetch_readonly"
      ],
      "allowed_domains": [
        "api.github.com",
        "github.com",
        "json-schema.org",
        "www.rfc-editor.org",
        "cursor.com"
      ],
      "mode": "allowlist"
    },
    "wall_time_seconds": 14400
  },
  "contract_id": "aec-issue-4251-code-tests",
  "created_at": "2026-08-01T20:05:00Z",
  "environment": {
    "environment_profile": "cdb-cloud-agent-readonly-secrets",
    "mcp_profiles": [
      "cdb_context_readonly"
    ],
    "provider_profile": {
      "extensions": {
        "api_surface": "cloud-agents-v1-public",
        "note": "Cursor-specific launch fields belong here; core schema stays provider-neutral"
      },
      "profile_name": "cloud-agent-delivery",
      "provider_id": "cursor"
    },
    "secret_references": [
      {
        "class": "github_token",
        "ref": "env:GH_TOKEN"
      }
    ],
    "skills": [
      "cdb-session-start",
      "cdb-pr-router",
      "cdb-session-close"
    ],
    "subagents": []
  },
  "execution_scope": {
    "allowed_commands_or_command_classes": [
      "git_read",
      "git_commit_push",
      "pytest_unit",
      "ruff_check",
      "gh_issue_comment",
      "gh_pr_edit",
      "python_module_tools"
    ],
    "allowed_paths": [
      "docs/contracts",
      "docs/contracts/*",
      "tools/agent_execution_contract",
      "tools/agent_execution_contract/*",
      "tests/unit/governance",
      "tests/unit/governance/*",
      "knowledge/governance",
      "knowledge/governance/*",
      "knowledge/logs/sessions",
      "knowledge/logs/sessions/*",
      "agents",
      "agents/*",
      "AGENTS.md"
    ],
    "delivery_target": {
      "expected_status": "DONE_SLICE_ADDED_TO_BATCH_PR",
      "mode": "batch_pr",
      "target_branch": "batch/agent-skills-issue-4250",
      "target_pr": 4286
    },
    "forbidden_paths": [
      "services",
      "services/*",
      "core",
      "core/*",
      "infrastructure/compose",
      "infrastructure/compose/*",
      ".github/workflows",
      ".github/workflows/*"
    ],
    "issue_scope": {
      "delivery_issue": 4251,
      "forbidden_follow_on_issues": [
        4252,
        4253,
        4254,
        4255,
        4256,
        4257,
        4258,
        4259,
        4260
      ],
      "topic": "AGENTS Control Plane"
    },
    "stop_conditions": [
      "HOLD_NO_SAFE_ROUTE",
      "HOLD_DEPENDENCY_NOT_READY",
      "HOLD_SCOPE_DRIFT",
      "HOLD_CONTRACT_INTEGRITY_NOT_PROVEN"
    ]
  },
  "integrity": {
    "canonicalization": "RFC8785",
    "digest": "sha256:f41b6a951448b656645ed28a8985ff0f3410aea47b9d10a770a2b83eb3bd41b5",
    "digest_algorithm": "sha256",
    "digest_encoding": "sha256:<lowercase-hex>"
  },
  "issue": {
    "number": 4251,
    "parent_issue": 4249,
    "predecessor_issue": 4250,
    "title": "[AGENTS][ROUTER] Define Agent Execution Contract v1 for PR Router handoff"
  },
  "permissions": {
    "close_issue": false,
    "comment_issue": true,
    "commit": true,
    "database_mutation": false,
    "mcp_live_mutation": false,
    "merge": false,
    "open_pr": false,
    "publish_cdb_local_ci": false,
    "push": true,
    "read_repo": true,
    "runtime_mutation": false,
    "update_pr": true,
    "write_code": true,
    "write_docs": true
  },
  "producer": {
    "agent": "cursor-cloud",
    "component": "pr_router_handoff",
    "policy_id": "cdb-pr-routing-v1"
  },
  "route": {
    "batch_key": "agent-skills",
    "lane": "agent-skills",
    "lock_state": "UNLOCKED",
    "merge_mode": "batch",
    "policy_id": "cdb-pr-routing-v1",
    "reason_codes": [
      "DEPENDENCY_CANON_ON_BATCH_HEAD",
      "LABEL_CREATE_FORBIDDEN_403"
    ],
    "router_observed_at": "2026-08-01T20:00:00Z",
    "routing_decision": "OPERATIONAL_BATCH_CONTINUATION",
    "target_branch": "batch/agent-skills-issue-4250",
    "target_pr": 4286,
    "validation_profile": "agent-skills-v1"
  },
  "schema_id": "cdb.agent_execution.v1",
  "schema_version": "1.0.0",
  "validation_and_delivery": {
    "allowed_delivery_statuses": [
      "DONE_SLICE_ADDED_TO_BATCH_PR",
      "HOLD_DEPENDENCY_NOT_READY",
      "HOLD_PR_LOCK_CONFLICT",
      "HOLD_NO_SAFE_ROUTE",
      "HOLD_SCOPE_DRIFT",
      "HOLD_CONTRACT_INTEGRITY_NOT_PROVEN"
    ],
    "evidence_requirements": [
      "targeted_slice_validation",
      "brain_evidence_block",
      "router_decision_record",
      "contract_hash_record",
      "issue_comment_handoff"
    ],
    "merge_authority": {
      "granted": false,
      "role": "none"
    },
    "required_validations": [
      "pytest tests/unit/governance/test_agent_execution_contract_v1.py",
      "pytest tests/unit/governance/test_pr_routing_contract.py",
      "git diff --check",
      "python -m tools.validate_readme_links"
    ]
  }
}
